{
  "$schema": "../../schemas/pattern.schema.json",
  "schema_version": "0.3.0",
  "vocab_version": "0.3.0",
  "id": "infest-vehicle",
  "status": "accepted",
  "name": "Infest a vehicle",
  "aliases": ["parasite", "latch onto a vehicle", "burrow into a vehicle"],
  "source_terms": ["Dismantler Claws", "rodeo", "boarding", "Parasitic Bomb", "Neural Parasite"],
  "category": "infiltration",
  "also_in": ["control"],
  "summary": "A small, cheap, fast and fragile attacker reaches an enemy vehicle and attaches to it: it burrows inside, clings on top or welds itself underneath. Once attached it is protected (untargetable in the purest form, or just hard to hit) and keeps working on the host until it is removed or the host dies. The effect can be damage over time, a slow, a blocked ability, a tracking mark, a timed charge or a full takeover. Removal is deliberately narrow, so the latch starts a visible clock that the victim and their team must beat. The trade-off is heavy exposure on the way in for safety once attached.",
  "counterplay": [
    "Kill it on the approach: infesters are fragile, so anti-infantry fire and point defence stop them before they connect.",
    "Keep moving and avoid stalls; a pin (stasis beam or EMP) is the infester's setup tool, so dodging the pin is the first defence.",
    "Remove it with repair: a repair station, repair drones, a repair tool or an engineer-crewed vehicle pulls the infester out.",
    "Use a self-cleanse on a cooldown, such as an electric discharge, smoke or a hold-to-shake-off input.",
    "Get a teammate to shoot the rider off, or to use an ability that clears the hull.",
    "Teleport or make the host invulnerable, which drops or suspends the infester.",
    "Sacrifice or abandon the host: bail out, or destroy your own vehicle to deny a chain jump or a hijack.",
    "Spread vehicles out so a chain jump or contagion can't spread through a group."
  ],
  "source_units": ["ra3.soviet.terror-drone"],
  "other_examples": [
    {
      "game": "extra:Command & Conquer: Red Alert 2 / Yuri's Revenge",
      "unit": "Terror Drone (Soviets)",
      "note": "The original: leaps inside a vehicle, can't be hit while inside, and pops out to dive the next vehicle if its own damage kills the host. One drone per vehicle; an infested construction vehicle can't deploy. Only repair removes it.",
      "sources": [
        {
          "url": "https://cnc.fandom.com/wiki/Terror_drone_(Red_Alert_2)",
          "title": "Terror drone (Red Alert 2), Command & Conquer Wiki",
          "kind": "wiki",
          "accessed": "2026-10-17"
        },
        {
          "url": "https://cncnz.com/games/red-alert-2/soviet-units/",
          "title": "Red Alert 2 Soviet units, CNCNZ",
          "kind": "database",
          "accessed": "2026-10-17"
        }
      ],
      "confidence": "high"
    },
    {
      "game": "ra3",
      "unit": "Burst Drone (Empire)",
      "note": "A flying scout that clings to the outside of a vehicle or aircraft, slows it and can self-destruct a few seconds later to hurt the host and its neighbours. Unlike the terror drone it can be shot off while attached, and repair drones destroy it.",
      "sources": [
        {
          "url": "https://cnc.fandom.com/wiki/Burst_drone",
          "title": "Burst drone, Command & Conquer Wiki",
          "kind": "wiki",
          "accessed": "2026-10-17"
        },
        {
          "url": "https://strategywiki.org/wiki/Command_%26_Conquer:_Red_Alert_3/Empire_of_the_Rising_Sun_units",
          "title": "Red Alert 3: Empire units, StrategyWiki",
          "kind": "wiki",
          "accessed": "2026-10-17"
        }
      ],
      "confidence": "high"
    },
    {
      "game": "extra:Command & Conquer: Tiberian Sun - Firestorm",
      "unit": "Limpet Drone (GDI and Nod)",
      "note": "Waits hidden like a mine, welds itself under the first vehicle that drives over it, halves its speed and reports what it sees. It does no real damage: a tracker, not a killer. Repair removes it; sensors reveal it and EMP destroys it.",
      "sources": [
        {
          "url": "https://cnc.fandom.com/wiki/Limpet_drone",
          "title": "Limpet drone, Command & Conquer Wiki",
          "kind": "wiki",
          "accessed": "2026-10-17"
        },
        {
          "url": "https://cncnz.com/features/nmenths-research-lab/drones/",
          "title": "Research Lab: drones, CNCNZ",
          "kind": "database",
          "accessed": "2026-10-17"
        }
      ],
      "confidence": "high"
    },
    {
      "game": "extra:Command & Conquer: Generals / Zero Hour",
      "unit": "Hijacker and hero sniper crew kill (GLA)",
      "note": "A stealthed, unarmed infantry unit that takes over most enemy vehicles on contact; a related hero shot kills a vehicle's crew from range and leaves it empty for anyone to claim. Uncrewed vehicles and loaded transports are immune.",
      "sources": [
        {
          "url": "https://cnc.fandom.com/wiki/Hijacker_(Generals_1)",
          "title": "Hijacker (Generals), Command & Conquer Wiki",
          "kind": "wiki",
          "accessed": "2026-10-17"
        },
        {
          "url": "https://cnc.fandom.com/wiki/Jarmen_Kell",
          "title": "Jarmen Kell, Command & Conquer Wiki",
          "kind": "wiki",
          "accessed": "2026-10-17"
        }
      ],
      "confidence": "high"
    },
    {
      "game": "extra:StarCraft II: Legacy of the Void",
      "unit": "Viper's parasitic bomb (Zerg)",
      "note": "Attaches a parasitic cloud to one enemy aircraft that damages it and every aircraft near it over several seconds, so the victim's best move is to leave its group. Damage values differ between versions.",
      "sources": [
        {
          "url": "https://starcraft.fandom.com/wiki/Viper",
          "title": "Viper, StarCraft Wiki",
          "kind": "wiki",
          "accessed": "2026-10-17"
        },
        {
          "url": "https://news.blizzard.com/en-us/article/18483059/starcraft-ii-legacy-of-the-void-beta-patchnotes-1-0",
          "title": "Legacy of the Void beta patch notes, Blizzard",
          "kind": "official",
          "accessed": "2026-10-17"
        }
      ],
      "confidence": "high"
    },
    {
      "game": "extra:StarCraft II",
      "unit": "Infestor's neural parasite (Zerg)",
      "note": "A tether that takes control of one enemy unit while the caster stays alive and within leash range. Kill the caster or pull the victim out of range to break it.",
      "sources": [
        {
          "url": "https://starcraft.fandom.com/wiki/Infestor",
          "title": "Infestor, StarCraft Wiki",
          "kind": "wiki",
          "accessed": "2026-10-17"
        }
      ],
      "confidence": "medium"
    },
    {
      "game": "extra:Halo Wars / Halo Wars 2",
      "unit": "Spartan vehicle hijack (UNSC)",
      "note": "Spartan heroes take over enemy vehicles; the target is frozen during the takeover, which is cancelled if the Spartan dies. In the sequel an EMP leap pins the target first.",
      "sources": [
        {
          "url": "https://www.halopedia.org/Red_Team",
          "title": "Red Team, Halopedia",
          "kind": "wiki",
          "accessed": "2026-10-17"
        },
        {
          "url": "https://www.halopedia.org/Boarding_(gameplay_mechanic)",
          "title": "Boarding (gameplay mechanic), Halopedia",
          "kind": "wiki",
          "accessed": "2026-10-17"
        }
      ],
      "confidence": "medium"
    }
  ],
  "shooter_analogues": [
    {
      "game": "extra:Titanfall / Titanfall 2",
      "unit": "Rodeo",
      "note": "A pilot climbs onto an enemy Titan and damages it from the back (the sequel turns this into stealing its battery and jumping off). The Titan hears a distinct sound and gets a warning, and can shake the rider off with electric smoke or by getting out. A friendly rider blocks enemy rodeos.",
      "sources": [
        {
          "url": "https://titanfall.wiki.gg/wiki/Rodeo",
          "title": "Rodeo, Titanfall Wiki",
          "kind": "wiki",
          "accessed": "2026-10-17"
        },
        {
          "url": "https://gdcvault.com/play/1024094/The-Evolution-of-Rodeo-in",
          "title": "The Evolution of Rodeo in Titanfall 2, GDC Vault",
          "kind": "official",
          "accessed": "2026-10-17"
        }
      ],
      "confidence": "high"
    },
    {
      "game": "extra:Halo series",
      "unit": "Vehicle boarding",
      "note": "Holding a button next to a vehicle throws the driver out; on tanks the boarder clings on top and punches through the hatch or drops a grenade in. Keep moving, have the gunner shoot boarders, or blow up your own vehicle to deny it.",
      "sources": [
        {
          "url": "https://www.halopedia.org/Boarding_(gameplay_mechanic)",
          "title": "Boarding (gameplay mechanic), Halopedia",
          "kind": "wiki",
          "accessed": "2026-10-17"
        }
      ],
      "confidence": "medium"
    },
    {
      "game": "extra:Battlefield: Bad Company 2 / Hardline",
      "unit": "Tracer dart",
      "note": "A dart stuck to an enemy vehicle lets teammates lock on with launchers and shows the vehicle to the team for a while: the tracker variant in player hands.",
      "sources": [
        {
          "url": "https://battlefield.fandom.com/wiki/Tracer_Dart",
          "title": "Tracer Dart, Battlefield Wiki",
          "kind": "wiki",
          "accessed": "2026-10-17"
        }
      ],
      "confidence": "medium"
    },
    {
      "game": "extra:ARC Raiders",
      "unit": "Tick (enemy machine)",
      "note": "Small spider robots leap onto players after a high-pitched wind-up and hurt them until removed. The victim holds a key to pull it off or a teammate shoots it off. AI-controlled, but a tested model of the victim's side.",
      "sources": [
        {
          "url": "https://arc-raiders.fandom.com/wiki/Tick",